{
  "protocol_version": 1,
  "message_id": "20000000-0000-4000-8000-000000000007",
  "message_type": "event_ack",
  "device_id": "11111111-1111-4111-8111-111111111111",
  "sent_at_utc": "2026-07-05T06:10:02Z",
  "session_id": "55555555-5555-4555-8555-555555555555",
  "payload": {
    "event_id": "66666666-6666-4666-8666-666666666666",
    "status": "persisted",
    "persisted_at_utc": "2026-07-05T06:10:02Z",
    "duplicate": false
  },
  "authentication": {
    "algorithm": "hmac-sha256",
    "key_id": "44444444-4444-4444-8444-444444444444",
    "payload_sha256": "sha256:781c2a0cb0f35ae031c676d1aeb36855c6de0d422142d0348c2cc9d6f3262334",
    "signature": "cfef5f602e7856012dfde883b5ef8c3a55e7d49d6ace86c3353e05d74392de6b"
  }
}
