{
  "protocol_version": 1,
  "message_id": "20000000-0000-4000-8000-000000000006",
  "message_type": "asset_transfer_start",
  "device_id": "22222222-2222-4222-8222-222222222222",
  "sent_at_utc": "2026-07-05T06:12:00Z",
  "session_id": "55555555-5555-4555-8555-555555555555",
  "payload": {
    "transfer_id": "99999999-9999-4999-8999-999999999999",
    "asset_hash": "sha256:185f8db32271fe25f561a6fc938b2e264306ec304eda518007d1764826381969",
    "mime": "image/png",
    "content_encoding": "none",
    "canonical_size": 5,
    "encoded_size": 5,
    "chunk_size": 0,
    "chunk_count": 0,
    "inline_data_b64": "SGVsbG8="
  },
  "authentication": {
    "algorithm": "hmac-sha256",
    "key_id": "44444444-4444-4444-8444-444444444444",
    "payload_sha256": "sha256:1e755a35d6b3ee709e4bc3e8cbcac80c00b114be99457df90fc33eb42692750d",
    "signature": "943cf4404d47bd153e5efc445e8d6c13c793d3223e3be930525816788e22f449"
  }
}
