{
  "protocol_version": 1,
  "message_id": "20000000-0000-4000-8000-000000000004",
  "message_type": "event_transfer_start",
  "device_id": "22222222-2222-4222-8222-222222222222",
  "sent_at_utc": "2026-07-05T06:11:00Z",
  "session_id": "55555555-5555-4555-8555-555555555555",
  "payload": {
    "transfer_id": "88888888-8888-4888-8888-888888888888",
    "event_id": "66666666-6666-4666-8666-666666666666",
    "content_type": "application/vnd.easynoty.notification-event+json",
    "content_encoding": "zstd",
    "canonical_size": 3145728,
    "encoded_size": 1048576,
    "canonical_sha256": "sha256:ffffffffffffffffffffffffffffffffffffffffffffffffffffffffffffffff",
    "chunk_size": 65536,
    "chunk_count": 16
  },
  "authentication": {
    "algorithm": "hmac-sha256",
    "key_id": "44444444-4444-4444-8444-444444444444",
    "payload_sha256": "sha256:d21e940ca787f1e892a642ae6366f2d1d40c933f924452e4aaf9a9a37a3001b4",
    "signature": "88d8a4c1e6c59a56030b415eb1adf6fac44e404a8ce00d9c5c2bc7f26882fc1f"
  }
}
