{
  "protocol_version": 1,
  "message_id": "20000000-0000-4000-8000-000000000002",
  "message_type": "auth_response",
  "device_id": "22222222-2222-4222-8222-222222222222",
  "sent_at_utc": "2026-07-05T06:05:00Z",
  "session_id": null,
  "payload": {
    "challenge_id": "33333333-3333-4333-8333-333333333333",
    "key_id": "44444444-4444-4444-8444-444444444444",
    "client_nonce": "cXdlcnR5dWlvcGFzZGZnaA",
    "proof": "bbbbbbbbbbbbbbbbbbbbbbbbbbbbbbbbbbbbbbbbbbbbbbbbbbbbbbbbbbbbbbbb"
  },
  "authentication": null
}
